"ssphp.cis_benchmark.control.number", "ssphp.use_case.foundational_system", "ssphp.use_case.id", "ssphp.use_case.savedsearch", "ssphp.use_case.title", "ssphp.cis_benchmark.control.title", "ssphp.cis_benchmark.control.profile_applicability", "ssphp.cis_benchmark.control.level", "ssphp.cis_benchmark.control.description", "ssphp.cis_benchmark.control.rationale", "ssphp.cis_benchmark.control.impact", "ssphp.cis_benchmark.control.group", "ssphp.cis_benchmark.controls.v8", "ssphp.cis_benchmark.controls.ig1", "ssphp.cis_benchmark.controls.ig2", "ssphp.cis_benchmark.controls.ig3", "ssphp.use_case.framework.ig_1", "ssphp.use_case.framework.ig_2", "ssphp.use_case.framework.ig_3", "ssphp.cis_benchmark.document.name", "ssphp.cis_benchmark.document.version", "ssphp.cis_benchmark.document.date", "ssphp.cis_benchmark.version", "ssphp.metadata.last_updated_by", "ssphp.metadata.last_updated_date"
"1.5.3", "GITHUB", "github_001_cis_1-5-3", "ssphp_use_case_github_001_cis_1-5-3", "GITHUB 001 [CIS 1.5.3]", "Ensure scanners are in place to secure Infrastructure as Code (IaC) instructions", "Level 2", "L2", "Detect and prevent misconfigurations or insecure instructions in Infrastructure as Code (IaC) files, such as Terraform files.", "Detecting and fixing misconfigurations and/or insecure instructions in IaC (Infrastructure as Code) files decreases the risk for data leak or data theft. It is important to secure IaC instructions in order to prevent further problems of deployment, exposed assets, or improper configurations, which can ultimately lead to easier ways to attack and steal organization data.", "", "Source Code", "7.5 Perform Automated Vulnerability Scans of Internal Enterprise Assets, 7.6 Perform Automated Vulnerability Scans of Externally-Exposed Enterprise Assets", "FALSE", "TRUE", "TRUE", "-", "7.5, 7.6", "7.5, 7.6", "CIS GitHub Benchmark", "1.0.0", "2022-12-28", "CIS v8", "Auto Document Extraction Script", "2024-03-20 17:27:15"
"1.5.4", "GITHUB", "github_001_cis_1-5-4", "ssphp_use_case_github_001_cis_1-5-4", "GITHUB 001 [CIS 1.5.4]", "Ensure scanners are in place for code vulnerabilities", "Level 2", "L2", "Detect and prevent known open source vulnerabilities in the code.", "Open source code blocks are used a lot in developed software. This has its own advantages, but it also has risks. Because the code is open for everyone, it means that attackers can publish or add malicious code to these open-source code blocks, or use their knowledge to find vulnerabilities in an existing code. Detecting and fixing such code vulnerabilities, by SCA (Software Composition Analysis) prevents insecure flaws from reaching production. It gives another opportunity for developers to secure the source code before it is deployed in production, where it is far more exposed and vulnerable to attacks.", "", "Source Code", "16.12 Implement Code-Level Security Checks, 16.13 Conduct Application Penetration Testing", "FALSE", "FALSE", "TRUE", "-", "-", "16.12, 16.13", "CIS GitHub Benchmark", "1.0.0", "2022-12-28", "CIS v8", "Auto Document Extraction Script", "2024-03-20 17:27:15"
"1.5.5", "GITHUB", "github_001_cis_1-5-5", "ssphp_use_case_github_001_cis_1-5-5", "GITHUB 001 [CIS 1.5.5]", "Ensure scanners are in place for open-source vulnerabilities in used packages", "Level 2", "L2", "Detect, prevent and monitor known open-source vulnerabilities in packages that are being used.", "Open-source vulnerabilities might exist before one starts to use a package, but they are also discovered over time. New attacks and vulnerabilities are announced every now and then. It is important to keep track of these and to monitor whether the dependencies used are affected by the recent vulnerability. Detecting and fixing those packages' vulnerabilities decreases the attack surface within deployed and running applications that use such packages. It prevents security flaws from reaching the production environment which could eventually lead to a security breach.", "", "Source Code", "7.5 Perform Automated Vulnerability Scans of Internal Enterprise Assets, 7.6 Perform Automated Vulnerability Scans of Externally-Exposed Enterprise Assets", "FALSE", "TRUE", "TRUE", "-", "7.5, 7.6", "7.5, 7.6", "CIS GitHub Benchmark", "1.0.0", "2022-12-28", "CIS v8", "Auto Document Extraction Script", "2024-03-20 17:27:15"
"1.5.6", "GITHUB", "github_001_cis_1-5-6", "ssphp_use_case_github_001_cis_1-5-6", "GITHUB 001 [CIS 1.5.6]", "Ensure scanners are in place for open-source license issues in used packages", "Level 2", "L2", "Detect open-source license problems in used dependencies and fix them.", "A software license is a legal document that establishes several key conditions between a software company or developer and a user in order to allow the use of software. Software licenses have the potential to create code dependencies. Not following the conditions in the software license can also lead to lawsuits. When using packages with a software license, especially commercial ones (which are the most permissive), it is important to verify what is allowed by that license in order to be protected against lawsuits.", "", "Source Code", "7.5 Perform Automated Vulnerability Scans of Internal Enterprise Assets, 7.6 Perform Automated Vulnerability Scans of Externally-Exposed Enterprise Assets", "FALSE", "TRUE", "TRUE", "-", "7.5, 7.6", "7.5, 7.6", "CIS GitHub Benchmark", "1.0.0", "2022-12-28", "CIS v8", "Auto Document Extraction Script", "2024-03-20 17:27:15"
"2.1.1", "GITHUB", "github_002_cis_2-1-1", "ssphp_use_case_github_002_cis_2-1-1", "GITHUB 002 [CIS 2.1.1]", "Ensure each pipeline has a single responsibility", "Level 2", "L2", "Ensure each pipeline has a single responsibility in the build process.", "Build pipelines generally have access to multiple secrets depending on their purposes. There are, for example, secrets of the test environment for the test phase, repository and artifact credentials for the build phase, etc. Limiting access to these credentials/secrets is therefore recommended by dividing pipeline responsibilities, as well as having a dedicated pipeline for each phase with the lowest privilege instead of a single pipeline for all. This will ensure that any potential damage caused by attacks on a workflow will be limited.", "", "Build Pipelines", "4.6 Securely Manage Enterprise Assets and Software, 16.10 Apply Secure Design Principles in Application Architectures", "TRUE", "TRUE", "TRUE", "4.6", "4.6, 16.10", "4.6, 16.10", "CIS GitHub Benchmark", "1.0.0", "2022-12-28", "CIS v8", "Auto Document Extraction Script", "2024-03-20 17:27:15"
"2.1.2", "GITHUB", "github_002_cis_2-1-2", "ssphp_use_case_github_002_cis_2-1-2", "GITHUB 002 [CIS 2.1.2]", "Ensure all aspects of the pipeline infrastructure and configuration are immutable", "Level 1", "L1", "Ensure the pipeline orchestrator and its configuration are immutable.", "An immutable infrastructure is one that cannot be changed during execution of the pipeline. This can be done, for example, by using Infrastructure as Code for configuring the pipeline and the pipeline environment. Utilizing such infrastructure creates a more predictable environment because updates will require re-deployment to prevent any previous configuration from interfering. Because it is dependent on automation, it is easier to revert changes. Testing code is also simpler because it is based on virtualization. Most importantly, an immutable pipeline infrastructure ensures that a potential attacker seeking to compromise the build environment itself would not be able to do so if the orchestrator, its configuration, and any other component cannot be changed. Verifying that all aspects of the pipeline infrastructure and configuration are immutable therefore keeps them safe from malicious tampering attempts.", "", "Build Pipelines", "16.1 Establish and Maintain a Secure Application Development Process", "FALSE", "TRUE", "TRUE", "-", "16.1", "16.1", "CIS GitHub Benchmark", "1.0.0", "2022-12-28", "CIS v8", "Auto Document Extraction Script", "2024-03-20 17:27:15"
"2.1.3", "GITHUB", "github_002_cis_2-1-3", "ssphp_use_case_github_002_cis_2-1-3", "GITHUB 002 [CIS 2.1.3]", "Ensure the build environment is logged", "Level 1", "L1", "Keep build logs of the build environment detailing configuration and all activity within it. Also, consider to store them in a centralized organizational log store.", "Logging the environment is important for two primary reasons: one, for debugging and investigating the environment in case of a bug or security incident; and two, for reproducing the environment easily when needed. Storing these logs in a centralized organizational log store allows the organization to generate useful insights and identify anomalies in the build process faster.", "", "Build Pipelines", "3.14 Log Sensitive Data Access", "FALSE", "FALSE", "TRUE", "-", "-", "3.14", "CIS GitHub Benchmark", "1.0.0", "2022-12-28", "CIS v8", "Auto Document Extraction Script", "2024-03-20 17:27:15"
"2.1.4", "GITHUB", "github_002_cis_2-1-4", "ssphp_use_case_github_002_cis_2-1-4", "GITHUB 002 [CIS 2.1.4]", "Ensure the creation of the build environment is automated", "Level 1", "L1", "Automate the creation of the build environment.", "Automating the deployment of the build environment reduces the risk for human mistakes such as a wrong configuration or exposure of sensitive data because it requires less human interaction and intervention. It also eases re-deployment of the environment. It is best to automate with Infrastructure as Code because it offers more control over changes made to the environment creation configuration and stores to a version control platform.", "", "Build Pipelines", "16.1 Establish and Maintain a Secure Application Development Process", "FALSE", "TRUE", "TRUE", "-", "16.1", "16.1", "CIS GitHub Benchmark", "1.0.0", "2022-12-28", "CIS v8", "Auto Document Extraction Script", "2024-03-20 17:27:15"
"2.1.5", "GITHUB", "github_002_cis_2-1-5", "ssphp_use_case_github_002_cis_2-1-5", "GITHUB 002 [CIS 2.1.5]", "Ensure access to build environments is limited", "Level 1", "L1", "Restrict access to the build environment (orchestrator, pipeline executor, their environment, etc.) to trusted and qualified users only.", "A build environment contains sensitive data such as environment variables, secrets, and the source code itself. Any user that has access to this environment can make changes to the build process, including changes to the code within it. Restricting access to the build environment to trusted and qualified users only will reduce the risk for mistakes such as exposure of secrets or misconfiguration. Limiting access also reduces the number of accounts that are vulnerable to hijacking in order to potentially harm the build environment.", "Reducing the number of users who have access to the build process means those users would lose their ability to make direct changes to that process.", "Build Pipelines", "6.8 Define and Maintain Role-Based Access Control", "FALSE", "FALSE", "TRUE", "-", "-", "6.8", "CIS GitHub Benchmark", "1.0.0", "2022-12-28", "CIS v8", "Auto Document Extraction Script", "2024-03-20 17:27:15"
"2.1.6", "GITHUB", "github_002_cis_2-1-6", "ssphp_use_case_github_002_cis_2-1-6", "GITHUB 002 [CIS 2.1.6]", "Ensure users must authenticate to access the build environment", "Level 1", "L1", "Require users to login in to access the build environment- where the orchestrator, the pipeline executer, where the build workers are running, etc.", "Requiring users to authenticate and disabling anonymous access to the build environment allows organization to track every action on that environment, good or bad, to its actor. This will help recognizing attack and its attacker becuase the authentication is required.", "Anonymous users won't be able to access the build environment.", "Build Pipelines", "2.5 Allowlist Authorized Software", "FALSE", "TRUE", "TRUE", "-", "2.5", "2.5", "CIS GitHub Benchmark", "1.0.0", "2022-12-28", "CIS v8", "Auto Document Extraction Script", "2024-03-20 17:27:15"
"2.1.7", "GITHUB", "github_002_cis_2-1-7", "ssphp_use_case_github_002_cis_2-1-7", "GITHUB 002 [CIS 2.1.7]", "Ensure build secrets are limited to the minimal necessary scope", "Level 2", "L2", "Build tools providers offer a secure way to store secrets that should be used during the build process. These secrets will often be credentials used to access other tools, for example for pulling code or for uploading artifacts. Access to these secrets can be defined on various scopes, for example in github it could be on an organization level or a repository level and there is also control on whether these secrets are passed to forked pull request. To protect these critical assets it is important to choose the most restrictive scope necessary.", "Allowing over permissive access to these secrets may affect on their exposure. For example if a secret is defined in an organization level, and users can create new repositories, there is a scenario where a user can create a new repo and run a controlled build just to exfiltrate these secrets.", "Increased risk of exposure of build related secrets.", "Build Pipelines", "5.4 Restrict Administrator Privileges to Dedicated Administrator Accounts", "TRUE", "TRUE", "TRUE", "5.4", "5.4", "5.4", "CIS GitHub Benchmark", "1.0.0", "2022-12-28", "CIS v8", "Auto Document Extraction Script", "2024-03-20 17:27:15"
"2.1.8", "GITHUB", "github_002_cis_2-1-8", "ssphp_use_case_github_002_cis_2-1-8", "GITHUB 002 [CIS 2.1.8]", "Ensure the build infrastructure is automatically scanned for vulnerabilities", "Level 1", "L1", "Scan the build infrastructure and its dependencies for vulnerabilities. It is recommended that this be done automatically.", "Automatic scanning for vulnerabilities detects known vulnerabilities in the tooling used by the build infrastructure and its dependencies. These vulnerabilities can lead to a potentially massive breach if not handled as fast as possible, as attackers might also be aware of such vulnerabilities.", "", "Build Pipelines", "7.5 Perform Automated Vulnerability Scans of Internal Enterprise Assets, 7.6 Perform Automated Vulnerability Scans of Externally-Exposed Enterprise Assets", "FALSE", "TRUE", "TRUE", "-", "7.5, 7.6", "7.5, 7.6", "CIS GitHub Benchmark", "1.0.0", "2022-12-28", "CIS v8", "Auto Document Extraction Script", "2024-03-20 17:27:15"
"2.1.9", "GITHUB", "github_002_cis_2-1-9", "ssphp_use_case_github_002_cis_2-1-9", "GITHUB 002 [CIS 2.1.9]", "Ensure default passwords are not used", "Level 1", "L1", "Do not use default passwords of build tools and components.", "Sometimes build tools and components are provided with default passwords for the first login. This password is intended to be used only on the first login and should be changed immediately after. Using the default password substantially increases the attack risk. It is especially important to ensure that default passwords are not used in build tools and components.", "", "Build Pipelines", "5.2 Use Unique Passwords", "TRUE", "TRUE", "TRUE", "5.2", "5.2", "5.2", "CIS GitHub Benchmark", "1.0.0", "2022-12-28", "CIS v8", "Auto Document Extraction Script", "2024-03-20 17:27:15"
"2.1.10", "GITHUB", "github_002_cis_2-1-10", "ssphp_use_case_github_002_cis_2-1-10", "GITHUB 002 [CIS 2.1.10]", "Ensure webhooks of the build environment are secured", "Level 1", "L1", "Use secured webhooks of the build environment.", "Webhooks are used for triggering an HTTP request based on an action made in the platform. Typically, build environment feature webhooks for a pipeline trigger based on source code event. Since webhooks are an HTTP POST request, they can be malformed if not secured over SSL. To prevent a potential hack and compromise of the webhook or to the environment or web server excepting the request, use only secured webhooks.", "", "Build Pipelines", "12.6 Use of Secure Network Management and Communication Protocols", "FALSE", "TRUE", "TRUE", "-", "12.6", "12.6", "CIS GitHub Benchmark", "1.0.0", "2022-12-28", "CIS v8", "Auto Document Extraction Script", "2024-03-20 17:27:15"
"2.1.11", "GITHUB", "github_002_cis_2-1-11", "ssphp_use_case_github_002_cis_2-1-11", "GITHUB 002 [CIS 2.1.11]", "Ensure minimum number of administrators are set for the build environment", "Level 1", "L1", "Ensure the build environment has a minimum number of administrators.", "Build environment administrators have the highest level of permissions, including the ability to add/remove users, create or delete pipelines, control build workers, change build trigger permissions and more. Due to the permissive access granted to a build environment administrator, it is highly recommended to keep the number of administrator accounts as minimal as possible.", "", "Build Pipelines", "5.4 Restrict Administrator Privileges to Dedicated Administrator Accounts", "TRUE", "TRUE", "TRUE", "5.4", "5.4", "5.4", "CIS GitHub Benchmark", "1.0.0", "2022-12-28", "CIS v8", "Auto Document Extraction Script", "2024-03-20 17:27:15"
"2.2.1", "GITHUB", "github_002_cis_2-2-1", "ssphp_use_case_github_002_cis_2-2-1", "GITHUB 002 [CIS 2.2.1]", "Ensure build workers are single-used", "Level 1", "L1", "Use a clean instance of build worker for every pipeline run.", "Using a clean instance of build worker for every pipeline run eliminates the risks of data theft, data integrity breaches, and unavailability. It limits the pipeline's access to data stored on the file system from previous runs, and the cache is volatile. This prevents malicious changes from affecting other pipelines or the Continuous Integration/Continuous Delivery system itself.", "Data and cache will not be saved in different pipeline runs.", "Build Pipelines", "3.12 Segment Data Processing and Storage Based on Sensitivity", "FALSE", "TRUE", "TRUE", "-", "3.12", "3.12", "CIS GitHub Benchmark", "1.0.0", "2022-12-28", "CIS v8", "Auto Document Extraction Script", "2024-03-20 17:27:15"
"2.2.2", "GITHUB", "github_002_cis_2-2-2", "ssphp_use_case_github_002_cis_2-2-2", "GITHUB 002 [CIS 2.2.2]", "Ensure build worker environments and commands are passed and not pulled", "Level 1", "L1", "A worker's environment can be passed (for example, a pod in a Kubernetes cluster in which an environment variable is passed to it). It also can be pulled, like a virtual machine that is installing a package. Ensure that the environment and commands are passed to the workers and not pulled from it.", "Passing an environment means additional configuration happens in the build time phase and not in run time. It will also pass locally and not remotely. Passing a worker environment, instead of pulling it from an outer source, reduces the possibility for an attacker to gain access and potentially pull malicious code into it. By passing locally and not pulling from remote, there is also less chance of an attack based on the remote connection, such as a man-in-the-middle or malicious scripts that can run from remote. This therefore prevents possible infection of the build worker.", "", "Build Pipelines", "16.1 Establish and Maintain a Secure Application Development Process", "FALSE", "TRUE", "TRUE", "-", "16.1", "16.1", "CIS GitHub Benchmark", "1.0.0", "2022-12-28", "CIS v8", "Auto Document Extraction Script", "2024-03-20 17:27:15"
"2.2.3", "GITHUB", "github_002_cis_2-2-3", "ssphp_use_case_github_002_cis_2-2-3", "GITHUB 002 [CIS 2.2.3]", "Ensure the duties of each build worker are segregated", "Level 1", "L1", "Separate responsibilities in the build workflow, such as testing, compiling, pushing artifacts, etc., to different build workers so that each worker will have a single duty.", "Separating duties and allocating them to many workers makes it easier to verify each step in the build process and ensure there is no corruption. It also limits the effect of an attack on a build worker, as such an attack would be less critical if the worker has less access and duties that are subject to harm.", "", "Build Pipelines", "16.1 Establish and Maintain a Secure Application Development Process", "FALSE", "TRUE", "TRUE", "-", "16.1", "16.1", "CIS GitHub Benchmark", "1.0.0", "2022-12-28", "CIS v8", "Auto Document Extraction Script", "2024-03-20 17:27:15"
"2.2.4", "GITHUB", "github_002_cis_2-2-4", "ssphp_use_case_github_002_cis_2-2-4", "GITHUB 002 [CIS 2.2.4]", "Ensure build workers have minimal network connectivity", "Level 1", "L1", "Ensure that build workers have minimal network connectivity.", "Restricting the network connectivity of build workers decreases the possibility that an attacker would be capable of entering the organization from the outside. If the build workers are connected to the public internet without any restriction, it is far simpler for attackers to compromise them. Limiting network connectivity between build workers also protects the organization in case an attacker was successful and subsequently attempts to spread the attack to other components of the environment.", "Developers will not have connectivity to every resource they might need from the outside. Workers will also only be able to exchange data through shareable storage.", "Build Pipelines", "13.5 Manage Access Control for Remote Assets", "FALSE", "TRUE", "TRUE", "-", "13.5", "13.5", "CIS GitHub Benchmark", "1.0.0", "2022-12-28", "CIS v8", "Auto Document Extraction Script", "2024-03-20 17:27:15"
"2.2.5", "GITHUB", "github_002_cis_2-2-5", "ssphp_use_case_github_002_cis_2-2-5", "GITHUB 002 [CIS 2.2.5]", "Ensure run-time security is enforced for build workers", "Level 1", "L1", "Add traces to build workers' operating systems and installed applications so that in run time, collected events can be analyzed to detect suspicious behavior patterns and malware.", "Build workers are exposed to data exfiltration attacks, code injection attacks, and more while running. It is important to secure them from such attacks by enforcing run-time security on the build worker itself. This will identify attempted attacks in real time and prevent them.", "", "Build Pipelines", "3.14 Log Sensitive Data Access", "FALSE", "FALSE", "TRUE", "-", "-", "3.14", "CIS GitHub Benchmark", "1.0.0", "2022-12-28", "CIS v8", "Auto Document Extraction Script", "2024-03-20 17:27:15"
"2.2.6", "GITHUB", "github_002_cis_2-2-6", "ssphp_use_case_github_002_cis_2-2-6", "GITHUB 002 [CIS 2.2.6]", "Ensure build workers are automatically scanned for vulnerabilities", "Level 1", "L1", "Scan build workers for vulnerabilities. It is recommended that this be done automatically.", "Automatic scanning for vulnerabilities detects known weaknesses in environmental sources in use, such as docker images or kernel versions. Such vulnerabilities can lead to a massive breach if these environments are not replaced as fast as possible, since attackers also know about these vulnerabilities and often try to take advantage of them. Setting automatic scanning which scans environmental sources ensures that if any new vulnerability is revealed, it can be replaced quickly and easily. This protects the worker from being exposed to attacks.", "", "Build Pipelines", "7.5 Perform Automated Vulnerability Scans of Internal Enterprise Assets", "FALSE", "TRUE", "TRUE", "-", "7.5", "7.5", "CIS GitHub Benchmark", "1.0.0", "2022-12-28", "CIS v8", "Auto Document Extraction Script", "2024-03-20 17:27:15"
"2.2.7", "GITHUB", "github_002_cis_2-2-7", "ssphp_use_case_github_002_cis_2-2-7", "GITHUB 002 [CIS 2.2.7]", "Ensure build workers' deployment configuration is stored in a version control platform", "Level 1", "L1", "Store the deployment configuration of build workers in a version control platform, such as Github.", "Build workers are a sensitive part of the build phase. They generally have access to the code repository, the Continuous Integration platform, the deployment platform, etc. This means that an attacker gaining access to a build worker may compromise other platforms in the organization and cause a major incident. One thing that can protect workers is to ensure that their deployment configuration is safe and well-configured. Storing the deployment configuration in version control enables more observability of these configurations because everything is catalogued in a single place. It adds another layer of security, as every change will be reviewed and noticed, and thus malicious changes will theoretically occur less. In the case of a mistake, bug, or security incident, it also offers an easier way to 'revert' back to a safe version or add a 'hot fix' quickly.", "Changes in deployment configuration may only be applied by declaration in the version control platform. This could potentially slow down the development process.", "Build Pipelines", "4.1 Establish and Maintain a Secure Configuration Process", "TRUE", "TRUE", "TRUE", "4.1", "4.1", "4.1", "CIS GitHub Benchmark", "1.0.0", "2022-12-28", "CIS v8", "Auto Document Extraction Script", "2024-03-20 17:27:15"
