"ssphp.cis_benchmark.control.number", "ssphp.use_case.foundational_system", "ssphp.use_case.id", "ssphp.use_case.savedsearch", "ssphp.use_case.title", "ssphp.cis_benchmark.control.title", "ssphp.cis_benchmark.control.profile_applicability", "ssphp.cis_benchmark.control.level", "ssphp.cis_benchmark.control.description", "ssphp.cis_benchmark.control.rationale", "ssphp.cis_benchmark.control.impact", "ssphp.cis_benchmark.control.group", "ssphp.cis_benchmark.controls.v8", "ssphp.cis_benchmark.controls.ig1", "ssphp.cis_benchmark.controls.ig2", "ssphp.cis_benchmark.controls.ig3", "ssphp.use_case.framework.ig_1", "ssphp.use_case.framework.ig_2", "ssphp.use_case.framework.ig_3", "ssphp.cis_benchmark.document.name", "ssphp.cis_benchmark.document.version", "ssphp.cis_benchmark.document.date", "ssphp.cis_benchmark.version", "ssphp.metadata.last_updated_by", "ssphp.metadata.last_updated_date"
"1.2.5", "GITHUB", "github_001_cis_1-2-5", "ssphp_use_case_github_001_cis_1-2-5", "GITHUB 001 [CIS 1.2.5]", "Ensure all copies (forks) of code are tracked and accounted for", "Level 1", "L1", "Track every fork of code and ensure it is accounted for.", "A fork is a copy of a repository. On top of being a plain copy, any updates to the original repository itself can be pulled and reflected by the fork under certain conditions. A large number of repository copies (forks) become difficult to manage and properly secure. New and sensitive changes can often be pushed into a critical repository without developer knowledge of an updated copy of the very same repository. If there is no limit on doing this, then it is recommended to track and delete copies of organization repositories as needed.", "Disabling forks completely may slow down the development process as more actions will be necessary to take in order to fork a repository.", "Source Code", "2.1 Establish and Maintain a Software Inventory, 3.14 Log Sensitive Data Access", "TRUE", "TRUE", "TRUE", "2.1", "2.1", "2.1, 3.14", "CIS GitHub Benchmark", "1.0.0", "2022-12-28", "CIS v8", "Auto Document Extraction Script", "2024-03-20 17:27:15"
"1.2.6", "GITHUB", "github_001_cis_1-2-6", "ssphp_use_case_github_001_cis_1-2-6", "GITHUB 001 [CIS 1.2.6]", "Ensure all code projects are tracked for changes in visibility status", "Level 1", "L1", "Ensure every change in visibility of projects is tracked.", "Visibility of projects determines who can access a project and/or fork it: anyone, designated users, or only members of the organization. If a private project becomes public, this may point to a potential attack, which can ultimately lead to data loss, the leaking of sensitive information, and finally to a supply chain attack. It is crucial to track these changes in order to prevent such incidents.", "", "Source Code", "3.14 Log Sensitive Data Access, 4.6 Securely Manage Enterprise Assets and Software", "TRUE", "TRUE", "TRUE", "4.6", "4.6", "3.14, 4.6", "CIS GitHub Benchmark", "1.0.0", "2022-12-28", "CIS v8", "Auto Document Extraction Script", "2024-03-20 17:27:15"
"1.2.7", "GITHUB", "github_001_cis_1-2-7", "ssphp_use_case_github_001_cis_1-2-7", "GITHUB 001 [CIS 1.2.7]", "Ensure inactive repositories are reviewed and archived periodically", "Level 1", "L1", "Track inactive repositories and remove them periodically.", "Inactive repositories (i.e., no new changes introduced for a long period of time) can enlarge the surface of a potential attack or data leak. These repositories are more likely to be improperly managed, and thus could possibly be accessed by a large number of users in an organization.", "Bug fixes and deployment of necessary changes could prove complicated for archived repositories.", "Source Code", "4.8 Uninstall or Disable Unnecessary Services on Enterprise Assets and Software", "FALSE", "TRUE", "TRUE", "-", "4.8", "4.8", "CIS GitHub Benchmark", "1.0.0", "2022-12-28", "CIS v8", "Auto Document Extraction Script", "2024-03-20 17:27:15"
"1.3.1", "GITHUB", "github_001_cis_1-3-1", "ssphp_use_case_github_001_cis_1-3-1", "GITHUB 001 [CIS 1.3.1]", "Ensure inactive users are reviewed and removed periodically", "Level 2", "L2", "Track inactive user accounts and periodically remove them.", "User accounts that have been inactive for a long period of time are enlarging the surface of attack. Inactive users with high-level privileges are of particular concern, as these accounts are more likely to be targets for attackers. This could potentially allow access to large portions of an organization should such an attack prove successful. It is recommended to remove them as soon as possible in order to prevent this.", "", "Source Code", "5.3 Disable Dormant Accounts", "TRUE", "TRUE", "TRUE", "5.3", "5.3", "5.3", "CIS GitHub Benchmark", "1.0.0", "2022-12-28", "CIS v8", "Auto Document Extraction Script", "2024-03-20 17:27:15"
"1.3.2", "GITHUB", "github_001_cis_1-3-2", "ssphp_use_case_github_001_cis_1-3-2", "GITHUB 001 [CIS 1.3.2]", "Ensure team creation is limited to specific members", "Level 1", "L1", "Limit ability to create teams to trusted and specific users.", "The ability to create new teams should be restricted to specific members in order to keep the organization orderly and ensure users have access to only the lowest privilege level necessary. Teams typically inherit permissions from their parent team, thus if base permissions are less restricted and any user has the ability to create a team, a permission leverage could occur in which certain data is made available to users who should not have access to it. Such a situation could potentially lead to the creation of shadow teams by an attacker. Restricting team creation will also reduce additional clutter in the organizational structure, and as a result will make it easier to track changes and anomalies.", "Only specific users will be able to create new teams.", "Source Code", "5.4 Restrict Administrator Privileges to Dedicated Administrator Accounts", "TRUE", "TRUE", "TRUE", "5.4", "5.4", "5.4", "CIS GitHub Benchmark", "1.0.0", "2022-12-28", "CIS v8", "Auto Document Extraction Script", "2024-03-20 17:27:15"
"1.3.3", "GITHUB", "github_001_cis_1-3-3", "ssphp_use_case_github_001_cis_1-3-3", "GITHUB 001 [CIS 1.3.3]", "Ensure minimum number of administrators are set for the organization", "Level 1", "L1", "Ensure the organization has a minimum number of administrators.", "Organization administrators have the highest level of permissions, including the ability to add/remove collaborators, create or delete repositories, change branch protection policy, and convert to a publicly-accessible repository. Due to the permissive access granted to an organization administrator, it is highly recommended to keep the number of administrator accounts as minimal as possible.", "", "Source Code", "5.4 Restrict Administrator Privileges to Dedicated Administrator Accounts", "TRUE", "TRUE", "TRUE", "5.4", "5.4", "5.4", "CIS GitHub Benchmark", "1.0.0", "2022-12-28", "CIS v8", "Auto Document Extraction Script", "2024-03-20 17:27:15"
"1.3.4", "GITHUB", "github_001_cis_1-3-4", "ssphp_use_case_github_001_cis_1-3-4", "GITHUB 001 [CIS 1.3.4]", "Ensure Multi-Factor Authentication (MFA) is required for contributors of new code", "Level 2", "L2", "Require collaborators from outside the organization to use Multi-Factor Authentication (MFA) in addition to a standard user name and password when authenticating to the source code management platform.", "By default every user authenticates within the system by password only. If the password of a user is compromised, however, the user account and every repository to which they have access are in danger of data loss, malicious code commits, and data theft. It is therefore recommended that each user has Multi-Factor Authentication enabled. This adds an additional layer of protection to ensure the account remains secure even if the user's password is compromised.", "A member without enabled Multi-Factor Authentication cannot contribute to the project. They must enable Multi-Factor Authentication a before they can contribute any code.", "Source Code", "6.3 Require MFA for Externally-Exposed Applications, 6.4 Require MFA for Remote Network Access, 6.5 Require MFA for Administrative Access", "TRUE", "TRUE", "TRUE", "6.4, 6.5", "6.3, 6.4, 6.5", "6.3, 6.4, 6.5", "CIS GitHub Benchmark", "1.0.0", "2022-12-28", "CIS v8", "Auto Document Extraction Script", "2024-03-20 17:27:15"
"1.3.5", "GITHUB", "github_001_cis_1-3-5", "ssphp_use_case_github_001_cis_1-3-5", "GITHUB 001 [CIS 1.3.5]", "Ensure the organization is requiring members to use Multi-Factor Authentication (MFA)", "Level 2", "L2", "Require members of the organization to use Multi-Factor Authentication (MFA) in addition to a standard user name and password when authenticating to the source code management platform.", "By default every user authenticates within the system by password only. If the password of a user is compromised, however, the user account and every repository to which they have access are in danger of data loss, malicious code commits, and data theft. It is therefore recommended that each user has Multi-Factor Authentication enabled. This adds an additional layer of protection to ensure the account remains secure even if the user's password is compromised.", "Members will be removed from the organization if they don't have Multi-Factor Authentication already enabled. If this is the case, it is recommended that an invitation be sent to reinstate the user's access and former privileges. They must enable Multi-Factor Authentication to accept the invitation.", "Source Code", "6.3 Require MFA for Externally-Exposed Applications, 6.4 Require MFA for Remote Network Access, 6.5 Require MFA for Administrative Access", "TRUE", "TRUE", "TRUE", "6.4, 6.5", "6.3, 6.4, 6.5", "6.3, 6.4, 6.5", "CIS GitHub Benchmark", "1.0.0", "2022-12-28", "CIS v8", "Auto Document Extraction Script", "2024-03-20 17:27:15"
"1.3.6", "GITHUB", "github_001_cis_1-3-6", "ssphp_use_case_github_001_cis_1-3-6", "GITHUB 001 [CIS 1.3.6]", "Ensure new members are required to be invited using company-approved email", "Level 2", "L2", "Existing members of an organization can invite new members to join, however new members must only be invited with their company-approved email.", "Ensuring new members of an organization have company-approved email prevents existing members of the organization from inviting arbitrary new users to join. Without this verification, they can invite anyone who is using the organization's version control system or has an active email account, thus allowing outside users (and potential threat actors) to easily gain access to company private code and resources. This practice will subsequently reduce the chance of human error or typos when inviting a new member.", "Existing members would not be able to invite new users who do not have a company-approved email address.", "Source Code", "6.1 Establish an Access Granting Process", "TRUE", "TRUE", "TRUE", "6.1", "6.1", "6.1", "CIS GitHub Benchmark", "1.0.0", "2022-12-28", "CIS v8", "Auto Document Extraction Script", "2024-03-20 17:27:15"
"1.3.7", "GITHUB", "github_001_cis_1-3-7", "ssphp_use_case_github_001_cis_1-3-7", "GITHUB 001 [CIS 1.3.7]", "Ensure two administrators are set for each repository", "Level 2", "L2", "Ensure every repository has two users with administrative permissions.", "Repository administrators have the highest permissions to said repository. These include the ability to add/remove collaborators, change branch protection policy, and convert to a publicly-accessible repository. Due to the liberal access granted to a repository administrator, it is highly recommended that only two contributors occupy this role.", "Removing administrative users from a repository would result in them losing high-level access to that repository.", "Source Code", "6.7 Centralize Access Control", "FALSE", "TRUE", "TRUE", "-", "6.7", "6.7", "CIS GitHub Benchmark", "1.0.0", "2022-12-28", "CIS v8", "Auto Document Extraction Script", "2024-03-20 17:27:15"
"1.3.8", "GITHUB", "github_001_cis_1-3-8", "ssphp_use_case_github_001_cis_1-3-8", "GITHUB 001 [CIS 1.3.8]", "Ensure strict base permissions are set for repositories", "Level 1", "L1", "Base permissions define the permission level automatically granted to all organization members. Define strict base access permissions for all of the repositories in the organization, including new ones.", "Defining strict base permissions is the best practice in every role-based access control (RBAC) system. If the base permission is high for example, 'write' permission every member of the organization will have 'write' permission to every repository in the organization. This will apply regardless of the specific permissions a user might need, which generally differ between organization repositories. The higher the permission, the higher the risk for incidents such as bad code commit or data breach. It is therefore recommended to set the base permissions to the strictest level possible.", "Users might not be able to access organization repositories or perform some acts as commits. These specific permissions should be granted individually for each user or team, as needed.", "Source Code", "16.7 Use Standard Hardening Configuration Templates for Application Infrastructure", "FALSE", "TRUE", "TRUE", "-", "16.7", "16.7", "CIS GitHub Benchmark", "1.0.0", "2022-12-28", "CIS v8", "Auto Document Extraction Script", "2024-03-20 17:27:15"
"1.3.9", "GITHUB", "github_001_cis_1-3-9", "ssphp_use_case_github_001_cis_1-3-9", "GITHUB 001 [CIS 1.3.9]", "Ensure an organization's identity is confirmed with a -Verified- badge", "Level 2", "L2", "Confirm the domains an organization owns with a 'Verified' badge.", "Verifying the organization's domain gives developers assurance that a given domain is truly the official home for a public organization. Attackers can pretend to be an organization and steal information via a faked/spoof domain, therefore the use of a 'Verified' badge instills more confidence and trust between developers and the open-source community.", "", "Source Code", "16.1 Establish and Maintain a Secure Application Development Process, 16.11 Leverage Vetted Modules or Services for Application Security Components", "FALSE", "TRUE", "TRUE", "-", "16.1, 16.11", "16.1, 16.11", "CIS GitHub Benchmark", "1.0.0", "2022-12-28", "CIS v8", "Auto Document Extraction Script", "2024-03-20 17:27:15"
"1.3.10", "GITHUB", "github_001_cis_1-3-10", "ssphp_use_case_github_001_cis_1-3-10", "GITHUB 001 [CIS 1.3.10]", "Ensure Source Code Management (SCM) email notifications are restricted to verified domains", "Level 2", "L2", "Restrict the Source Code Management (SCM) organization's email notifications to approved domains only.", "Restricting Source Code Management email notifications to verified domains only prevents data leaks, as personal emails and custom domains are more prone to account takeover via DNS hijacking or password breach.", "Only members with approved email would be able to receive Source Code Management notifications.", "Source Code", "13.11 Tune Security Event Alerting Thresholds", "FALSE", "FALSE", "TRUE", "-", "-", "13.11", "CIS GitHub Benchmark", "1.0.0", "2022-12-28", "CIS v8", "Auto Document Extraction Script", "2024-03-20 17:27:15"
"1.3.11", "GITHUB", "github_001_cis_1-3-11", "ssphp_use_case_github_001_cis_1-3-11", "GITHUB 001 [CIS 1.3.11]", "Ensure an organization provides SSH certificates", "Level 2", "L2", "As an organization, become an SSH Certificate Authority and provide SSH keys for accessing repositories.", "There are two ways for remotely working with Source Code Management: via HTTPS, which requires authentication by user/password, or via SSH, which requires the use of SSH keys. SSH authentication is better in terms of security; key creation and distribution, however, must be done in a secure manner. This can be accomplished by implementing SSH certificates, which are used to validate the server's identity. A developer will not be able to connect to a Git server if its key cannot be verified by the SSH Certificate Authority (CA) server. As an organization, one can verify the SSH certificate signature used to authenticate if a CA is defined and used. This ensures that only verified developers can access organization repositories, as their SSH key will be the only one signed by the CA certificate. This reduces the risk of misuse and malicious code commits.", "Members with unverified keys will not be able to clone organization repositories. Signing, certification, and verification might also slow down the development process.", "Source Code", "12.7 Ensure Remote Devices Utilize a VPN and are Connecting to an Enterprise-s AAA Infrastructure", "FALSE", "TRUE", "TRUE", "-", "12.7", "12.7", "CIS GitHub Benchmark", "1.0.0", "2022-12-28", "CIS v8", "Auto Document Extraction Script", "2024-03-20 17:27:15"
"1.3.12", "GITHUB", "github_001_cis_1-3-12", "ssphp_use_case_github_001_cis_1-3-12", "GITHUB 001 [CIS 1.3.12]", "Ensure Git access is limited based on IP addresses", "Level 2", "L2", "Limit Git access based on IP addresses by having a allowlist of IP addresses from which connection is possible.", "Allowing access to Git repositories (source code) only from specific IP addresses adds yet another layer of restriction and reduces the risk of unauthorized connection to the organization's assets. This will prevent attackers from accessing Source Code Management (SCM), as they would first need to know the allowed IP addresses to gain access to them.", "Only members with allowlisted IP addresses will be able to access the organization's Git repositories.", "Source Code", "2.5 Allowlist Authorized Software, 2.6 Allowlist Authorized Libraries", "FALSE", "TRUE", "TRUE", "-", "2.5, 2.6", "2.5, 2.6", "CIS GitHub Benchmark", "1.0.0", "2022-12-28", "CIS v8", "Auto Document Extraction Script", "2024-03-20 17:27:15"
"1.3.13", "GITHUB", "github_001_cis_1-3-13", "ssphp_use_case_github_001_cis_1-3-13", "GITHUB 001 [CIS 1.3.13]", "Ensure anomalous code behavior is tracked", "Level 1", "L1", "Track code anomalies.", "Carefully analyze any code anomalies within the organization. For example, a code anomaly could be a push made outside of working hours. Such a code push has a higher likelihood of being the result of an attack, as most if not all members of the organization would likely be outside the office. Another example is an activity that exceeds the average activity of a particular user. Tracking and auditing such behaviors creates additional layers of security and can aid in early detection of potential attacks.", "", "Source Code", "16.12 Implement Code-Level Security Checks", "FALSE", "FALSE", "TRUE", "-", "-", "16.12", "CIS GitHub Benchmark", "1.0.0", "2022-12-28", "CIS v8", "Auto Document Extraction Script", "2024-03-20 17:27:15"
"1.4.1", "GITHUB", "github_001_cis_1-4-1", "ssphp_use_case_github_001_cis_1-4-1", "GITHUB 001 [CIS 1.4.1]", "Ensure administrator approval is required for every installed application", "Level 1", "L1", "Ensure an administrator approval is required when installing applications.", "Applications are typically automated integrations that improve the workflow of an organization. They are written by third-party developers, and therefore should be validated before using in case they're malicious or not trustable. Because administrators are expected to be the most qualified and trusted members of the organization, they should review the applications being installed and decide whether they are both trusted and necessary.", "Applications will not be installed without administrator approval.", "Source Code", "2.5 Allowlist Authorized Software, 2.6 Allowlist Authorized Libraries", "FALSE", "TRUE", "TRUE", "-", "2.5, 2.6", "2.5, 2.6", "CIS GitHub Benchmark", "1.0.0", "2022-12-28", "CIS v8", "Auto Document Extraction Script", "2024-03-20 17:27:15"
"1.4.2", "GITHUB", "github_001_cis_1-4-2", "ssphp_use_case_github_001_cis_1-4-2", "GITHUB 001 [CIS 1.4.2]", "Ensure stale applications are reviewed and inactive ones are removed", "Level 1", "L1", "Ensure stale (inactive) applications are reviewed and removed if no longer in use.", "Applications that have been inactive for a long period of time are enlarging the surface of attack for data leaks. They are more likely to be improperly managed, and could possibly be accessed by third-party developers as a tool for collecting internal data of the organization or repository in which they are installed. It is important to remove these inactive applications as soon as possible.", "", "Source Code", "2.2 Ensure Authorized Software is Currently Supported, 2.4 Utilize Automated Software Inventory Tools", "TRUE", "TRUE", "TRUE", "2.2", "2.2, 2.4", "2.2, 2.4", "CIS GitHub Benchmark", "1.0.0", "2022-12-28", "CIS v8", "Auto Document Extraction Script", "2024-03-20 17:27:15"
"1.4.3", "GITHUB", "github_001_cis_1-4-3", "ssphp_use_case_github_001_cis_1-4-3", "GITHUB 001 [CIS 1.4.3]", "Ensure the access granted to each installed application is limited to the least privilege needed", "Level 1", "L1", "Ensure installed application permissions are limited to the lowest privilege level required.", "Applications are typically automated integrations that can improve the workflow of an organization. They are written by third-party developers, and therefore should be reviewed carefully before use. It is recommended to use the 'least privilege' principle, granting applications the lowest level of permissions required. This may prevent harm from a potentially malicious application with unnecessarily high-level permissions leaking data or modifying source code.", "", "Source Code", "6.8 Define and Maintain Role-Based Access Control", "FALSE", "FALSE", "TRUE", "-", "-", "6.8", "CIS GitHub Benchmark", "1.0.0", "2022-12-28", "CIS v8", "Auto Document Extraction Script", "2024-03-20 17:27:15"
"1.4.4", "GITHUB", "github_001_cis_1-4-4", "ssphp_use_case_github_001_cis_1-4-4", "GITHUB 001 [CIS 1.4.4]", "Ensure only secured webhooks are used", "Level 1", "L1", "Use only secured webhooks in the source code management platform.", "A webhook is an event listener, attached to critical and sensitive parts of the software delivery process. It is triggered by a list of events (such as a new code being committed), and when triggered, the webhook sends out a notification with some payload to specific internet endpoints. Since the payload of the webhook contains sensitive organization data, it's important all webhooks are directed to an endpoint (URL) protected by SSL verification (HTTPS). This helps ensure that the data sent is delivered to securely without any man-in-the-middle, who could easily access and even alter the payload of the request.", "Perform the following to ensure all webhooks used are secured (HTTPS): 1. Navigate to your organization or repository and select Settings. 2. Select Webhooks on the side menu. 3. Verify that each webhook URL starts with 'https'.", "Source Code", "2.7 Allowlist Authorized Scripts", "FALSE", "FALSE", "TRUE", "-", "-", "2.7", "CIS GitHub Benchmark", "1.0.0", "2022-12-28", "CIS v8", "Auto Document Extraction Script", "2024-03-20 17:27:15"
"1.5.1", "GITHUB", "github_001_cis_1-5-1", "ssphp_use_case_github_001_cis_1-5-1", "GITHUB 001 [CIS 1.5.1]", "Ensure scanners are in place to identify and prevent sensitive data in code", "Level 2", "L2", "Detect and prevent sensitive data in code, such as confidential ID numbers, passwords, etc.", "Having sensitive data in the source code makes it easier for attackers to maliciously use such information. In order to avoid this, designate scanners to identify and prevent the existence of sensitive data in the code.", "", "Source Code", "7.5 Perform Automated Vulnerability Scans of Internal Enterprise Assets, 7.6 Perform Automated Vulnerability Scans of Externally-Exposed Enterprise Assets", "FALSE", "TRUE", "TRUE", "-", "7.5, 7.6", "7.5, 7.6", "CIS GitHub Benchmark", "1.0.0", "2022-12-28", "CIS v8", "Auto Document Extraction Script", "2024-03-20 17:27:15"
"1.5.2", "GITHUB", "github_001_cis_1-5-2", "ssphp_use_case_github_001_cis_1-5-2", "GITHUB 001 [CIS 1.5.2]", "Ensure scanners are in place to secure Continuous Integration (CI) pipeline instructions", "Level 2", "L2", "Detect and prevent misconfigurations and insecure instructions in CI pipelines", "Detecting and fixing misconfigurations or insecure instructions in CI pipelines decreases the risk for a successful attack through or on the CI pipeline. The more secure the pipeline, the less risk there is for potential exposure of sensitive data, a deployment being compromised, or external access mistakenly being granted to the CI infrastructure or the source code.", "", "Source Code", "7.5 Perform Automated Vulnerability Scans of Internal Enterprise Assets, 7.6 Perform Automated Vulnerability Scans of Externally-Exposed Enterprise Assets", "FALSE", "TRUE", "TRUE", "-", "7.5, 7.6", "7.5, 7.6", "CIS GitHub Benchmark", "1.0.0", "2022-12-28", "CIS v8", "Auto Document Extraction Script", "2024-03-20 17:27:15"
